{
  "$schema": "../preset.schema.json",
  "version": 1,
  "id": "sol-only",
  "description": "Use GPT-5.6 Sol with high reasoning for every Frontier role.",
  "stability": "stable",
  "models": {
    "sol-high": {
      "reasoningEffort": "high",
      "targets": {
        "codex": "gpt-5.6-sol",
        "opencode": "openai/gpt-5.6-sol"
      }
    }
  },
  "roles": {
    "coordinator": "sol-high",
    "planner": "sol-high",
    "scout": "sol-high",
    "implementer": "sol-high",
    "reviewer-spec": "sol-high",
    "reviewer-code": "sol-high",
    "reviewer-ops": "sol-high",
    "repairer": "sol-high",
    "integrator": "sol-high"
  }
}
